{
  "schema": "mesh-noroeste.data/v1",
  "generated_at": "2026-07-25T12:00:00Z",
  "application": {
    "name": "Mesh Noroeste",
    "version": "0.1.0"
  },
  "region": {
    "name": "Galicia, Asturias, oeste de Castilla y León y Portugal",
    "bounds": {
      "south": 36.75,
      "west": -9.75,
      "north": 43.95,
      "east": -4.25
    }
  },
  "retention": {
    "active_hours": 24,
    "recent_days": 7,
    "historical_days": 30
  }
}
